{"schemaVersion":2,"id":"1c095be0-04b4-425c-9f4d-ca33bde67c79","version":0,"title":"On-campus vs Off-campus Housing Decision","description":"I am deciding whether to live on campus or off campus for 9 months. On-campus housing costs $1500 per month and off-campus housing costs $1100 per month, both billed monthly with no upfront fee. Utilities are included in both rents, with no additional housing charges. A one-way commute to campus takes 10 minutes from on-campus housing and 40 minutes from off-campus housing. Both commutes are free. I make 10 one-way commute trips each week. I prefer lower total cost.","domain":"housing","decisionType":"choose_one","goals":[{"text":"Minimize total housing cost over 9 months","basis":"explicit"}],"currency":"USD","context":{"months":9,"usesPerWeek":10,"budgetCents":null,"budgetScope":"total","source":{"kind":"user","note":"Derived from user input: 9‑month horizon and 10 one‑way commute trips per week.","quote":"I am deciding whether to live on campus or off campus for 9 months."}},"options":[{"id":"on_campus","name":"On-campus housing","description":"Live in university-provided housing with monthly rent $1500, utilities included, 10‑minute one‑way commute.","materials":[]},{"id":"off_campus","name":"Off-campus housing","description":"Live in off‑campus rental with monthly rent $1100, utilities included, 40‑minute one‑way commute.","materials":[]}],"factors":[{"id":"total_cost_9m","name":"Total cost over 9 months","reason":"User prefers lower total cost","optionIds":["on_campus","off_campus"],"dataType":"money","unit":"USD","allowedValues":[],"direction":"lower","purpose":"preference","importance":5,"target":{},"values":{"on_campus":{"value":1350000,"source":{"kind":"user","note":"Monthly rent multiplied by 9 months.","quote":"On-campus housing costs $1500 per month and off-campus housing costs $1100 per month, both billed monthly with no upfront fee."}},"off_campus":{"value":990000,"source":{"kind":"user","note":"Monthly rent multiplied by 9 months.","quote":"On-campus housing costs $1500 per month and off-campus housing costs $1100 per month, both billed monthly with no upfront fee."}}},"source":{"kind":"user","note":"Factor reflects user’s explicit preference for lower total cost.","quote":"On-campus housing costs $1500 per month and off-campus housing costs $1100 per month, both billed monthly with no upfront fee."},"confirmed":false,"ruleId":null},{"id":"commute_time_oneway","name":"One-way commute time","reason":"Commute time affects daily schedule and overall convenience.","optionIds":["on_campus","off_campus"],"dataType":"duration","unit":"min","allowedValues":[],"direction":"lower","purpose":"reference","importance":3,"target":{},"values":{"on_campus":{"value":10,"source":{"kind":"user","note":"Stated one‑way commute time for on‑campus housing.","quote":"A one-way commute to campus takes 10 minutes from on-campus housing and 40 minutes from off-campus housing."}},"off_campus":{"value":40,"source":{"kind":"user","note":"Stated one‑way commute time for off‑campus housing.","quote":"A one-way commute to campus takes 10 minutes from on-campus housing and 40 minutes from off-campus housing."}}},"source":{"kind":"user","note":"Factor captures commute duration provided by the user.","quote":"A one-way commute to campus takes 10 minutes from on-campus housing and 40 minutes from off-campus housing."},"confirmed":false,"ruleId":null}],"primaryFactorId":null,"questions":[],"charts":["cost_bar","time_bar"],"origin":"model"}